{"schema":"work-directive.v1","directiveId":"d-1","packageId":"01J9ZZZZZZZZZZZZZZZZZZZZZ1","seq":1,"issuer":{"kind":"human","id":"user:7"},"issuedAt":"2026-09-05T10:00:00Z","kind":"steer","payload":{"text":"use the existing helper"},"digest":"sha256:2929540ee24cc2c4d259863fb9dd7e7e721674724faab546d92358764c2d1879"}
